# Lightweight transactions: UPDATE IF conditions.
#
# CQL UPDATE with IF clause performs a conditional update: the
# mutation only applies if the condition evaluates to true against
# the current row. The result is a rows result set with an [applied]
# column, matching Cassandra's LWT semantics.

exec
USE defaultdb
----

# Create a table (shared across tests in this file).
exec
CREATE TABLE IF NOT EXISTS lwt_upd (id int, name text, val int, PRIMARY KEY (id))
----

# ---------------------------------------------------------------
# Plain UPDATE (without IF) is supported.
# ---------------------------------------------------------------

exec
INSERT INTO lwt_upd (id, name, val) VALUES (1, 'alice', 100)
----

exec
UPDATE lwt_upd SET name = 'bob' WHERE id = 1
----

query
SELECT id, name, val FROM lwt_upd WHERE id = 1
----
id name val
1 bob 100

# ---------------------------------------------------------------
# UPDATE multiple columns.
# ---------------------------------------------------------------

exec
UPDATE lwt_upd SET name = 'carol', val = 200 WHERE id = 1
----

query
SELECT id, name, val FROM lwt_upd WHERE id = 1
----
id name val
1 carol 200

# ---------------------------------------------------------------
# UPDATE IF EXISTS: row exists → [applied]=true.
# ---------------------------------------------------------------

query
UPDATE lwt_upd SET val = 300 WHERE id = 1 IF EXISTS
----
[applied]
true

query
SELECT id, name, val FROM lwt_upd WHERE id = 1
----
id name val
1 carol 300

# ---------------------------------------------------------------
# UPDATE IF EXISTS on missing row → [applied]=false.
# ---------------------------------------------------------------

query
UPDATE lwt_upd SET val = 999 WHERE id = 999 IF EXISTS
----
[applied]
false

# ---------------------------------------------------------------
# UPDATE IF column = value: condition matches → [applied]=true.
# ---------------------------------------------------------------

query
UPDATE lwt_upd SET name = 'dave' WHERE id = 1 IF name = 'carol'
----
[applied]
true

query
SELECT id, name, val FROM lwt_upd WHERE id = 1
----
id name val
1 dave 300

# ---------------------------------------------------------------
# UPDATE IF column = value: condition does NOT match →
# [applied]=false with existing row.
# ---------------------------------------------------------------

query
UPDATE lwt_upd SET name = 'eve' WHERE id = 1 IF name = 'alice'
----
[applied] id name val
false 1 dave 300

# Row is unchanged because the IF condition was false.
query
SELECT id, name, val FROM lwt_upd WHERE id = 1
----
id name val
1 dave 300

# ---------------------------------------------------------------
# UPDATE IF column != value: condition matches → [applied]=true.
# ---------------------------------------------------------------

query
UPDATE lwt_upd SET val = 999 WHERE id = 1 IF val != 100
----
[applied]
true

query
SELECT id, name, val FROM lwt_upd WHERE id = 1
----
id name val
1 dave 999

# ---------------------------------------------------------------
# UPDATE IF column != value: condition does NOT match →
# [applied]=false with existing row.
# ---------------------------------------------------------------

query
UPDATE lwt_upd SET val = 0 WHERE id = 1 IF val != 999
----
[applied] id name val
false 1 dave 999

query
SELECT id, name, val FROM lwt_upd WHERE id = 1
----
id name val
1 dave 999

# ---------------------------------------------------------------
# UPDATE with multiple IF conditions: all must match.
# ---------------------------------------------------------------

query
UPDATE lwt_upd SET name = 'frank', val = 500 WHERE id = 1 IF name = 'dave' AND val = 999
----
[applied]
true

query
SELECT id, name, val FROM lwt_upd WHERE id = 1
----
id name val
1 frank 500

# ---------------------------------------------------------------
# UPDATE with multiple IF conditions: one does not match →
# [applied]=false with existing row.
# ---------------------------------------------------------------

query
UPDATE lwt_upd SET name = 'ghost' WHERE id = 1 IF name = 'frank' AND val = 100
----
[applied] id name val
false 1 frank 500

# val is 500, not 100, so the update is a no-op.
query
SELECT id, name, val FROM lwt_upd WHERE id = 1
----
id name val
1 frank 500
